cue,defn
Site Factors,"Location factors related to the costs of factors of production inside the plant
Situation,The location of a place relative to other places.
Situation Factors,Location factors related to the transportation of materials into and from a factory.
Slash-and-burn Agriculture,"Another name for shifting cultivation
Solstice,Time when the Sun is farthest from the equator.
Sovereignty,Ability of a state to govern its territory free from control of its internal affairs by other states.
Space,The physical gap or interval between two objects.
Space-time Compression,"The reduction in the time it takes to diffuse something to a distant place
Sprawl,Development of new housing sites at relatively low density  and at locations that are not contiguous to the existing built-up area.
Spring Wheat,Wheat planted in the spring and harvested in the late summer.
Squatter Settlement,An area within a city in a less developed country in which people illegally establish residences on land they do not own or rent and erect homemade structures.
Standard Language,"The form of a language used for official government business
State,An area organized into a political unit and ruled by an established government with control over its internal and foreign affairs.
Stimulus Diffusion,"The spread of an underlying principle
Structural Adjustment Program,"Economic policies imposed on less developed countries by international agencies to create conditions encouraging trade
Subsistence Agriculture,Agriculture designed primarily to provide food for direct consumption by the farmer and the farmer's family.
Sustainable Agriculture,"Farming methods that preserve long-term productivity of land and minimize pollution
Sustainable Development,The level of development that can be maintained in a country without depleting resources to the extent that future generations will be unable to achieve a comparable level of development.
Swidden,A patch of land cleared for planting through slashing and burning.
Taboo,A restriction on behavior imposed by social custom.
Tertiary Sector,"The portion of the economy concerned with transportation
Textile,"A fabric made by weaving
Thresh,To beat out grain from stalks by trampling it.
Threshold,The minimum number of people needed to support the service.
Toponym,The name given to a portion of Earth's surface.
Total Fertility Rate (TFR),The average number of children a women will have throughout her childbearing years.
Township,A square normally 6 miles on a side. The Land Ordinance of 1785 divided much of the US into a series of townships.
Trading Bloc,A group of neighboring countries that promote trade with each other and erect barriers to limit trade with other blocs.
Transhumance,The seasonal migration of livestock between mountains and lowland pastures.
Transnational Corporation,"A company that conducts research
Transportation and Information Services,Services that diffuse and distribute services.
Truck Farming,"Commercial gardening and fruit farming
Underclass,A group in society prevented from participating in the material benefits of a more developed society because of a variety of social and economic characteristics.
Undocumented Immigrants,People who enter a country without proper documents.
Uneven Development,The increasing gap in economic conditions between core and peripheral regions as a result of the globalization of the economy.
Unitary State,An internal organization of a state that places most power in the hands of central government officials.
Universalizing Religion,"A religion that attempts to appeal to all people
Urban Renewal,"Program in which cities identify blighted inner-city neighborhoods
Urbanization,An increase in the percentage and in the number of people living in urban settlements.
Urbanized Area,"In the US
Value Added,The gross value of the product minus the costs of raw materials and energy.
Vegetative Planting,Reproduction of plants by direct cloning from existing plants.
Vernacular Region (or perceptual region),An area that people believe to exist as part of their cultural identity.
Voluntary Migration,Permanent movement undertaken by choice.
Vulgar Latin,"A form of Latin used in daily conversation by ancient Romans
Wet Rice,"Rice planted on dryland in a nursery
Winnow,To remove chaff by allowing it to be blown away by the wind.
Winter Wheat,Wheat planted in the fall and harvested in the early summer.
Zero Population Growth (ZPG),A decline of the total fertility rate to the point where the natural increase rate equals zero.
Zoning Ordinance,A law that limits the permitted uses of land and maximum density of development in a community.
