cue,defn
Acid Deposition,"Sulfur oxides  and nitrogen oxides
Acid Precipitation,"Conversion of sulfur oxides and nitrogen oxides to acids that return to Earth as rain
Active Solar Energy Systems,Solar energy system that collects energy through the use of mechanical devices like photovoltaic calls or flat-plate collectors.
Agribusiness,"Commercial agriculture characterized by integration of different steps in the food-processing industry
Agricultural Density,The ratio of the number of farmers to the total amount of land suitable for agriculture.
Agricultural Revolution,The time when human beings first domesticated plants and animals and no longer relied entirely on hunting and gathering.
Agriculture,The deliberate effort to modify a portion of Earth's surface through cultivation of crops and the raising of livestock for sustenance or economic gain.
Air Pollution,"Concentration of trace substances
Animate Power,Power supplied by people or animals.
Animism,"Belief that objects
Annexation,Legally adding land area to a city in the US.
Apartheid,Laws (no longer in effect) in South Africa that physically separated different races into different geographic areas.
Arithmetic Density,The total number of people divided by the total land area.
Autonomous Religion,A religion that doesn't have a central authority but shares ideas and cooperates informally.
Balance of Power,Condition of roughly equal strength between opposing countries or alliances of countries.
Balkanization,Process by which a state breaks down through conflicts among its ethnicities.
Balkanized,"A small geographic area that could not successfully be organized into one or more stable states because it was inhabited by many ethnicities with complex
Base Line,An east-west line designated under the Land Ordinance of 1785 to facilitate the surveying and numbering of townships in the US.
Basic Industries,Industries that sell their products or services primarily to consumers outside the settlement.
Biochemical Oxygen Demand,Amount of oxygen required by aquatic bacteria to decompose a given load of organic waste; a measure of water pollution.
Biodiversity,The number of species within a specific habitat.
Biomass Fuel,Fuel that derives from plant material and animal waste.
Blockbusting,A process by which real estate agents convince white  property owners to sell their houses at low prices because of fear that black families will soon move into the neighborhood.
Boundary,Invisible line that marks the extent of a state's territory.
Brain Drain,Large-scale emigration by talented people.
Branch (of religion),A large and fundamental division within a religion.
Break-of-Bulk Point,A location where transfer is possible from one mode of transportation to another.
Breeder Reactor,A nuclear power plant that creates its own fuel from plutonium.
British Received Pronunciation,The dialect of English associated with upper-class Britons living in the London area and now considered standard in the UK
Bulk-gaining Industry,An industry in which the final product weighs more or comprises a greater volume than the inputs.
Bulk-reducing industry,An industry in which the final product weighs less or comprises a lower volume than the inputs.
Business Services,Services that primarily meet the needs of other businesses.
Cartography,The science of making maps.
Caste,The class or distinct hereditary order into which a Hindu is assigned according to religious law.
Census Tract,"An area delineated by the US Bureau of the Census for which statistics are published; in urbanized areas
Census,A complete enumeration of a population.
Central Business District,The area of the city where retail and office activities are clustered.
Central Place Theory,"A theory that explains the distribution of services
Central Place,A market center for the exchange of services by people attracted from the surrounding area.
Centripetal Force,An attitude that tends to unify people and enhance support for a state.
Cereal Grain,A grass yielding grain for food.
Chaff,Husks of grain separated from the seed by threshing.
Chain Migration,Migration of people to a specific location because relatives or members of the same nationality previously migrated there.
Chlorofluorocarbon CFC,"A gas used as a solvent
Circulation,"Short-term
City-State,"A sovereign state comprising a city and its immediate hinterland
Clustered Rural Settlement,A rural settlement in which the houses and farm buildings of each family are situated close to each other and fields surround the settlement.
Colonialism,"Attempt by one country to establish settlements and to impose its political
Colony,A territory that is legally tied to a sovereign state rather than completely independent.
Combine,"A machine that reaps
Commercial Agriculture,Agriculture undertaken primarily to generate products for sale off the farm.
Compact State,A state in which the distance from the center to any boundary does not vary significantly.
Concentration,The spread of something over a given area.
Concentric Zone Model,A model of the internal structure of cities in which social groups are spatially arranged in a series of rings.
Connections,Relationships among people and objects across the barrier of space.
Conservation,"The sustainable use and management of a natural resource
Consumer Services,"Businesses that provide services primarily to individual consumers
Contagious Diffusion,"The rapid
Cosmogony,A set of religious beliefs concerning the origin of the universe.
Cottage Industry,"Manufacturing based in homes rather than on a factory
Council of Government,A cooperative agency consisting of representatives of local governments in a metropolitan area in the US.
Counterurbanization,Net migration from urban to rural areas in MDCs.
Creole or Creolized Language,A language that results from the mixing of a colonizer's language with the indigenous language of the people being dominated.
Crop Rotation,"The practice of rotating use of different fields from crop to crop each year
Crop,Grain or fruit gathered from a field as a harvest during a particular season.
Crude Birth Rate,"The total number of live births in a year for every 1
Crude Death Rate,"The total number of deaths for every 1
Cultural Ecology,Geographic approach that emphasizes human-environment relationships.
Cultural Landscape,Fashioning of a natural landscape by a cultural group.
Culture,"The body of customary beliefs
Custom,"The frequent repetition of an act
Demographic Transition,"The process of changing in a society's population from a condition of high crude birth and death rates and low rate of natural increase to a condition of low crude birth and death rates
Demography,The scientific study of population characteristics.
Denomination,A division of a branch that unites a number of local congregations in a single legal and administrative body.
Density,The frequency with which something exists within a given unit of area.
Density Gradient,The change in density in an urban area from the center to the periphery.
Dependency Ratio,"The number of people under the age of 15 and over the age of 64
Desertification,"Degradation of land
Development,A process of improvement in the material conditions of people through diffusion of knowledge and technology.
Dialect,"A regional variation of a language distinguished by vocabulary
Diffusion,The process of spread of a feature or trend from one place to another over time.
Diocese,The basic unit of geographic organization in the Roman Catholic Church.
Dispersed Rural Settlement,A rural settlement pattern characterized by isolated farms rather than clustered villages.
Distance Decay,The diminishing in importance and eventual disappearance of a phenomenon with increasing distance from its origin.
Distribution,The arrangement of something across Earth's surface.
Double Cropping,Harvesting twice a year from the same field.
Doubling Time,"The number of years needed to double a population
Ebonics,Dialect spoken by some African-Americans.
Economic Base,A community's collection of basic industries.
Ecumene,The portion of Earth's surface occupied by permanent human settlement.
Edge City,A large node of office and retail activities on the edge of an urban area.
Elongated State,"A state with a long
Emigration,Migration FROM a location.
Enclosure Movement,The process of consolidating small landholdings into a smaller number of larger farms in England during the 18th Century.
Environmental Determinism,A 19th- and early 20th- century approach to the study of geography that argued that the general laws sought by human geographers could be found in the physical sciences. Geography was therefore  the study of how the physical environment caused human activities.
Epidemiological Transition,Distinctive causes of death in each stage of the demographic transition.
Epidemiology,"Branch of medical science concerned with the incidence
Ethnic Cleansing,Process in which more powerful ethnic group forcibly removes a less powerful one in order to create an ethnically homogeneous region.
Ethnic Religion,A religion with a relatively concentrated spatial distribution whose principles are likely to be based on the physical characteristics of the particular location in which its adherents are concentrated.
Ethnicity,Identity with a group of people that share distinct physical and mental traits as a product of common heredity and cultural traditions.
Expansion Diffusion,The spread of a feature or trend among people from one area to another in a snowballing process.
Extinct Language,A language that was once used by people in daily activities but is no longer used.
Federal State,An internal organization of a state that allocates most powers to units of local government.
Ferrous,"Metal
Filtering,"A process of change in the use of a house
Fission,The splitting of an atomic nucleus to release energy.
Floodplain,The area subject to flooding during a given number of years according to historical trends.
Folk Culture,"Culture traditionally practiced by a small
Forced Migration,Permanent movement compelled usually by cultural factors.
Fordist Production,Form of mass production in which each worker is assigned one specific task to perform repeatedly.
Formal Region,(or uniform or homogeneous) An area in which everyone shares in one or more distinctive characteristics.
Fossil Fuel,Energy source formed from the residue of plants and animals buried millions of years ago.
Fragmented State,A state that includes several discontinuous pieces of territory.
Frontier,A zone separating two states in which neither state exercises political control.
Functional (or nodal) Region,An area organized around a nodal or focal point.
Fundamentalism,"Literal interpretation and strict adherence to basic principles of a religion (or a religious branch
Fusion,Creation of energy by joining the nuclei of two hydrogen atoms to form helium.
Gender Empowerment Measure (GEM),Compares the ability of women and men to participate in economic and political decision making.
Gender-Related Development Index (GDI),Compares the level of development of women with that of both sexes.
Gentrification,A process of converting an urban neighborhood from a predominantly low-income renter-occupied area to a predominantly middle-class owner-occupied area.
Geothermal Energy,Energy from steam or hot water produced from hot or molten underground rocks.
Gerrymandering,Process of redrawing legislative boundaries for the purpose of benefiting the party in power.
Ghetto,"During the Middle Ages
GIS,"A computer system that stores
Globalization,Actions or processes that involve the entire world and result in making something worldwide in scope.
Global Positioning System (GPS),"A system that determines the precise position of something on Earth through a series of satellites
Grain,Seed of a cereal grass.
Gravity Model,A model that holds that the potential use of a service at a particular location is directly related to the number of people in a location and inversely related to the distance people must travel to reach the service.
Green Revolution,"Rapid diffusion of new agricultural technology
Greenbelt,"A ring of land maintained as parks
Greenhouse Effect,"Anticipated increase in Earth's temperature
Greenwich Mean Time,"The time in that time zone encompassing the prime meridian
Gross Domestic Product (GDP),The value of the total output of goods and services produced in a country in a given time period (normally one year).
Guest Workers,"Workers who migrate to the MDCs of Northern and Western Europe
Habit,A repetitive act performed by a particular individual.
Hearth,The region from which innovative ideas originate.
Hierarchical Diffusion,The spread of a feature or trend from one key person or node of authority or power to other persons or places.
Hierarchical Religion,A religion in which a central authority exercises a high degree of control.
Horticulture,"The growing of fruits
Hull,The outer covering of a seed.
Human Development Index (HDI),"Indicator of level of development for each country
Hydroelectric Power,Power generated from moving water.
Ideograms,"The system of writing used in China and other East Asian countries in which each symbol represents n idea or a concept rather than a specific sound
Immigration,Migration TO a new location.
Imperialism,Control of territory already occupied and organized by an indigenous society.
Inanimate Power,Power supplied by machines.
Industrial Revolution,A series of improvements in industrial technology that transformed the process of manufacturing goods.
Infant Mortality Rate (IMR),"The total number of deaths in a year among infants under one year old for every 1
Intensive Subsistence Agriculture,A form of subsistence agriculture in which farmers must expend a relatively large amount of effort to produce the maximum feasible yield from a parcel of land.
Internal Migration,Permanent movement within a particular country.
International Date Line,"(shortened) An arc that mainly follows 180 longitude. When crossed heading east (toward America)
International Migration,Permanent movement from one country to another.
Interregional Migration,Permanent movement from one region of a country to another.
Intervening Obstacle,An environmental or cultural feature of the landscape that hinders migration.
Intraregional Migration,Permanent movement within one region of a country.
Isogloss,A boundary that separates regions in which different language usages predominate.
,
Isolated Language,A language that is unrelated to any other languages and therefore not attached to any language family.
Labor-intensive Industry,An industry for which labor costs comprise a high percentage of total expenses.
Landlocked State,A state that doesn't have a direct outlet to the sea.
Land Ordinance of 1785,A law that divided much of the US into a system of townships to facilitate the sale of land to settlers.
Language,"A system of communication through the use of speech
Language Branch,"A collection of languages related through a common ancestor that existed several thousand years ago. Differences are not as extensive or old as with language families
Language Family,A collection of languages related to each other through a common ancestor long before recorded history.
Language Group,A collection of languages within a branch that share a common origin in the relatively recent past and display relatively few differences in grammar and vocabulary.
Latitude,The numbering system used to indicate the location of parallels drawn on the globe and measuring distance north and south of the equator.
Less Developed Country (LDC),"Also known as a developing country
Life Expectancy,"The average number of years an individual can be expected to live
Lingua Franca,A language mutually understood and commonly used in trade by people who have different native languages.
Literacy Rate,The percentage of a country's people who can read and write.
Literary Tradition,A language that is written as well as spoken.
Location,The position of anything on Earth's surface.
Longitude,The numbering system used to indicate the location of meridians drawn on a globe and measuring distance east and west of the prime meridian.
Map,"A two-dimensional
Maquiladora,"Factories built by US companies in Mexico near the US border
Market Area (or hinterland),"The area surrounding a central place
Medical Revolution,"Medical technology invented in Europe and North America that is diffused to the poorer countries of Latin America
Mental Map,"An internal representation of a portion of Earth's surface based on what an individual knows about a place
Meridian,An arc drawn on a map between the North and South poles.
Metropolitan Statistical Area (MSA),"In the US
Micropolitan Statistical Area,"An urbanized area of between 10
Microstate,A state that encompasses a very small land area.
Migration,Form of relocation diffusion involving permanent move to a new location.
Migration Transition,"Change in the migration pattern in a society that results from industrialization
Milkshed,The area surrounding a city from which milk is supplied.
Missionary,An individual who helps to diffuse a universalizing religion.
Mobility,All types of movement from one location to another.
Monotheism,The doctrine or belief of the existence of only one god.
More Developed Country (MDC),"Also known as a relatively developed country or a developed country
Multi-ethnic State,State that contains more than one ethnicity.
Multinational State,State that contains two or more ethnic groups with traditions of self-determination that agree to coexist peacefully by recognizing each other as distinct nationalities.
Multiple Nuclei Model,A model of the internal structure of cities in which social groups are arranged around a collection of nodes of activities.
Nationlism,Loyalty and devotion to a particular nationality.
Nationality,Identity with a group of people that share legal attachment and personal allegiance to a particular place as a result of being born there.
Nation-state,A state whose territory corresponds to that occupied by a particular ethnicity that has been transformed into a nationality.
Natural Increase Rate (NIR),"The percentage growth of a population in a year
Net Migration,The difference between the level of immigration and the level of emigration.
New International Division of Labor,"Transfer of some types of jobs
Nonbasic Industries,Industries that sell their products primarily to consumers in the community.
Nonferrous,Metals utilized to make products other than iron and steel.
Nonrenewable Energy,A source of energy that is a finite supply capable of being exhausted.
Official Language,The language adopted for use by the government for the conduct of business and publication of documents.
Overpopulation,The number of people living in an area exceeds the capacity of the environment to support life at a decent standard of living.
Ozone,"A gas that absorbs ultraviolet solar radiation
Paddy,"Malay word for wet rice
Pagan,A follower of a polytheistic religion in ancient times.
Pandemic,Disease that occurs over a wide geographic area and affects a high proportion of the population.
Parallel,A circle drawn around the globe parallel to the equator and at right angles to the meridians.
Passive Solar Energy  Systems,Solar energy system that collects energy without the use of mechanical devices.
Pastoral Nomadism,A form of subsistence agriculture based on herding domesticated animals.
Pasture,"Grass or other plants grown for feeding grazing animals
Pattern,The geometric or regular arrangement of something in a study area.
Perforated State,A state that completely surrounds another one.
Peripheral Model,A model of North America urban areas consisting of an inner city surrounded by large suburban residential and business areas tied together by a beltway or ring road.
Personal Services,Services that provide for the well-being and personal improvement of individual consumers.
Photochemical Smog,"An atmospheric condition formed through a combination of weather conditions and pollution
Photovoltaic Cell,"Solar energy cells
Physiological Density,The number of people per unit of area of arable land.
Pidgin Language,"A form of speech that adopts a simplified grammar and limited vocabulary of a lingua franca
Pilgrimage,A journey to a place considered scared for religious purposes.
Place,A specific point on Earth distinguished by a particular character.
Plantation,"A large farm in tropical and subtropical climates that specializes in the production of one or two crops for sale
Polder,Land created by the Dutch by draining water from an area.
Pollution,Addition of more waste than a resource can accommodate.
Polytheism,Belief in or worship of more than one god.
Popular Culture,"Culture found in a large
Population Pyramid,A bar graph representing the distribution of population by age and sex.
Possibilism,"The theory that the physical environment may set limits on human actions
Post-Fordist Production,"Adoption by companies of flexible work rules
Potential Reserve,The amount of energy in deposits not yet identified but thought to exist.
Preservation,"Maintenance of a resource in its present condition
Primary Sector,"The portion of the economy concerned with the direct extraction of materials from Earth's surface
Primate City,"The largest settlement in a country
Primate City Rule,"A pattern of settlements in a country
Prime Agricultural Land,The most productive farmland.
Prime Meridian,"The meridian
Principal Meridian,A north-south line designated in the Land Ordinance of 1785 to facilitate the surveying and numbering of townships in the US.
Producer Services,Services that primarily help people conduct business.
Productivity,The value of a particular product compared to the amount of labor needed to make it.
Projection,The system used to transfer locations from Earth's surface to a flat map.
Prorupted State,An otherwise compact state with a large projecting extension.
Proven Reserve,The amount of a resource remaining in discovered deposits.
Public Housing,"Housing owned by the government; in the US
Public Services,Services offered by the government to provide security and protection for citizens and businesses.
Pull Factors,Factors that induce people to move to a new location.
Push Factors,Factors that induce people to leave old residences.
Quota,"In reference to migration
Race,Identity with a group of people descended from a common ancestor.
Racism,Belief that race is the primary determinant of human traits and capacities and that racial differences produce an inherent superiority of a particular race.
Racist,A person who suscribes to the beliefs of racism.
Radioactive Waste,Particles from a nuclear reaction that emit radiation; contact with such particle may be harmful or lethal to people and must therefore be safely stored for thousands of years.
Ranching,A form of commercial agriculture in which livestock graze over an extensive area.
Range (of a service),The maximum distance people are willing to travel to use a service.
Rank-size Rule,"A pattern of settlements in a country
Reaper,A machine that cuts grain standing in the field.
Recycling,"The separation
Redlining,A process by which banks draw lines on a map and refuse to lend money to purchase or improve property within the boundaries.
Refugees,"People who are forced to migrate from their home country and cannot return for fear of persecution because of their race
Region,An area distinguished by a unique combination of trends or features.
Regional (or cultural landscape) Studies,An approach to geography that emphasizes the relationships among social and physical phenomena in a particular study area.
Relocation Diffusion,The spread of a feature or trend through bodily movement of people from one place to another.
Remote Sensing,The acquisition of data about Earth's surface from a satellite orbiting the planet or other long-distance methods.
Renewable Energy,A resource that has a theoretically unlimited supply and is not depleted when used by humans.
Resource,"A substance in the environment that is useful to people
Retail Services,Services that provide goods for sale to consumers.
Ridge Tillage,"System of planting crops on ridge tops
Right-to-work State,A US state that has passed a law preventing a union and company from negotiating a contract that requires workers to join a union as a condition of employment.
Rush (or peak) Hour,The four consecutive 15-minute periods in the morning and evening with the heaviest volumes of traffic.
Sanitary Landfill,"A place to deposit solid waste
Sawah,A flooded field for growing rice.
Scale,"Generally
Secondary Sector,"The portion of the economy concerned with manufacturing useful products through processing
Sect,A relatively small group that has broken away from an established denomination.
Section,A square normally 1 mile on a side. The Land Ordinance of 1785 divided townships in the US into 36 sections.
Sector Model,"A model of the internal structure of cities in which social groups are arranged around a series of sectors
Seed Agriculture,"Reproduction of plants through annual introduction of seeds
Self-determination,Concept that ethnicities have the right to govern themselves.
Service,Any activity that fulfills a human want or need and returns money to those who provide it.
Settlement,A permanent collection of buildings and inhabitants.
Sex Ratio,The number of males per 100 females in the population.
Sharecropper,A person who works fields rented from a landowner and pays the rent and repays loans by turning over to the landowner a share of the crops.
Shifting Cultivation,A form of subsistence agriculture in which people shift activity from one field to another; each field is used for crops for a relatively few years and left fallow for a relatively long period.
Site,The physical character of a place.
